<?xml version="1.0" encoding="UTF-8"?>

<!--
    Document   : employmentRecordXmlSchema.xml
    Created on : January 31, 2012, 10:56 PM
    Author     : julio
    Description:
        Purpose of the document follows.
-->

<ns0:records  xmlns:xsi='http://www.w3.org/2001/XMLSchema-instance'
   xmlns:ns0='http://xml.netbeans.org/schema/employmentRecordXmlSchema'
   xsi:schemaLocation='http://xml.netbeans.org/schema/employmentRecordXmlSchema ../schema/employmentRecordXmlSchema.xsd'>
    <ns0:employmentRecord>
        <ns0:employeeInfo>
            <ns0:firstName>Julio</ns0:firstName>
            <ns0:lastName>Vargas</ns0:lastName>
            <ns0:id>5930764</ns0:id>
            <ns0:gender>M</ns0:gender>
            <ns0:birthDate>1984-11-04</ns0:birthDate>
            <ns0:homeCountry>Bolivia</ns0:homeCountry>
        </ns0:employeeInfo>
        <ns0:companyInfo name="Microsoft">
            <ns0:contactInfo>
                <ns0:email>contact@microsoft.com</ns0:email>
                <ns0:phone>(425) 882-8080</ns0:phone>
            </ns0:contactInfo>
        </ns0:companyInfo>
        <ns0:startDate>2010-01-01</ns0:startDate>
        <ns0:endDate>2011-06-01</ns0:endDate>
        <ns0:positions>
            <ns0:position>
                <ns0:positionTitle>Intern</ns0:positionTitle>
                <ns0:entranceDate>2010-01-01</ns0:entranceDate>
                <ns0:exitDate>2010-05-30</ns0:exitDate>
                <ns0:hoursPerWeek>30</ns0:hoursPerWeek>
                <ns0:location>USA</ns0:location>
                <ns0:exitReason>promoted</ns0:exitReason>
            </ns0:position>
            <ns0:position>
                <ns0:positionTitle>developer</ns0:positionTitle>
                <ns0:entranceDate>2010-06-01</ns0:entranceDate>
                <ns0:exitDate>2011-06-01</ns0:exitDate>
                <ns0:hoursPerWeek>40</ns0:hoursPerWeek>
                <ns0:location>USA</ns0:location>
                <ns0:exitReason>promoted</ns0:exitReason>
            </ns0:position>
        </ns0:positions>
    </ns0:employmentRecord>
</ns0:records>
